{
  "candidate_only": true,
  "candidate_sha256": "sha256:9d79708538bdc974c304d0fbbcaab80e22e5174a4869f143b1d0e36ccdec1523",
  "coverage": {
    "direct_allocation": "complete",
    "exact_path_serialization": "complete",
    "expansion_seed_scope": "complete",
    "graph_target_enumeration": "complete",
    "live_active_equivalence": "complete",
    "substrate": "complete",
    "target_dispositions": "complete",
    "unexpanded_direct_reserve": "complete"
  },
  "decision_trail_connected": false,
  "enumerated_graph_targets": [
    {
      "admission_path": {
        "authoring_pointer": {
          "family": "allies",
          "item_index": 2,
          "path": "data/curation/relation_semantics/signaling.json"
        },
        "compiled_pointer": "data/relationship_graph.json#/1151",
        "direction": "outgoing_authored_relation",
        "edge_type": "ally",
        "hop_count": 1,
        "relation_id": "signaling::abstraction::ally",
        "source_custody": {
          "bytes": 17160,
          "exact_span": {
            "end_char_exclusive": 5932,
            "start_char": 5908
          },
          "path": "data/model_sources/Signaling_rag.md",
          "sha256": "0a516fcb644f13e4d92d84d35682e55b51bb89b10c76dbf1c8b1c7a78f32d367",
          "source_anchor_state": "exact_span"
        },
        "source_model_id": "signaling",
        "source_order": 1151,
        "target_model_id": "abstraction"
      },
      "disposition": "active_graph_slot",
      "path_coverage": {
        "exact_path_count": 1,
        "omitted_path_count": 0,
        "partial_reason": "",
        "serialized_path_count": 1,
        "status": "complete"
      },
      "provenance_paths": [
        {
          "authoring_pointer": {
            "family": "allies",
            "item_index": 2,
            "path": "data/curation/relation_semantics/signaling.json"
          },
          "compiled_pointer": "data/relationship_graph.json#/1151",
          "direction": "outgoing_authored_relation",
          "edge_type": "ally",
          "hop_count": 1,
          "relation_id": "signaling::abstraction::ally",
          "source_custody": {
            "bytes": 17160,
            "exact_span": {
              "end_char_exclusive": 5932,
              "start_char": 5908
            },
            "path": "data/model_sources/Signaling_rag.md",
            "sha256": "0a516fcb644f13e4d92d84d35682e55b51bb89b10c76dbf1c8b1c7a78f32d367",
            "source_anchor_state": "exact_span"
          },
          "source_model_id": "signaling",
          "source_order": 1151,
          "target_model_id": "abstraction"
        }
      ],
      "selected_relation_slot": "ally",
      "semantic_rejection_performed": false,
      "target_model_id": "abstraction"
    },
    {
      "admission_path": null,
      "disposition": "reserve_graph_capacity",
      "path_coverage": {
        "exact_path_count": 1,
        "omitted_path_count": 0,
        "partial_reason": "",
        "serialized_path_count": 1,
        "status": "complete"
      },
      "provenance_paths": [
        {
          "authoring_pointer": {
            "family": "allies",
            "item_index": 1,
            "path": "data/curation/relation_semantics/social-proof.json"
          },
          "compiled_pointer": "data/relationship_graph.json#/1168",
          "direction": "outgoing_authored_relation",
          "edge_type": "ally",
          "hop_count": 1,
          "relation_id": "social-proof::authority-bias::ally",
          "source_custody": {
            "bytes": 13155,
            "exact_span": null,
            "path": "data/model_sources/Social_Proof_rag.md",
            "sha256": "6e5dee9d9188be21aed265cf4b81482b181ee23623e3e2030830226b12478f8e",
            "source_anchor_state": "unresolved"
          },
          "source_model_id": "social-proof",
          "source_order": 1168,
          "target_model_id": "authority-bias"
        }
      ],
      "selected_relation_slot": "",
      "semantic_rejection_performed": false,
      "target_model_id": "authority-bias"
    },
    {
      "admission_path": null,
      "disposition": "reserve_graph_capacity",
      "path_coverage": {
        "exact_path_count": 1,
        "omitted_path_count": 0,
        "partial_reason": "",
        "serialized_path_count": 1,
        "status": "complete"
      },
      "provenance_paths": [
        {
          "authoring_pointer": {
            "family": "allies",
            "item_index": 3,
            "path": "data/curation/relation_semantics/signaling.json"
          },
          "compiled_pointer": "data/relationship_graph.json#/1152",
          "direction": "outgoing_authored_relation",
          "edge_type": "ally",
          "hop_count": 1,
          "relation_id": "signaling::commitment-bias::ally",
          "source_custody": {
            "bytes": 17160,
            "exact_span": null,
            "path": "data/model_sources/Signaling_rag.md",
            "sha256": "0a516fcb644f13e4d92d84d35682e55b51bb89b10c76dbf1c8b1c7a78f32d367",
            "source_anchor_state": "unresolved"
          },
          "source_model_id": "signaling",
          "source_order": 1152,
          "target_model_id": "commitment-bias"
        }
      ],
      "selected_relation_slot": "",
      "semantic_rejection_performed": false,
      "target_model_id": "commitment-bias"
    },
    {
      "admission_path": {
        "authoring_pointer": {
          "family": "antagonists",
          "item_index": 0,
          "path": "data/curation/relation_semantics/signaling.json"
        },
        "compiled_pointer": "data/relationship_graph.json#/1153",
        "direction": "outgoing_authored_relation",
        "edge_type": "antagonist",
        "hop_count": 1,
        "relation_id": "signaling::confirmation-bias::antagonist",
        "source_custody": {
          "bytes": 17160,
          "exact_span": {
            "end_char_exclusive": 13444,
            "start_char": 13392
          },
          "path": "data/model_sources/Signaling_rag.md",
          "sha256": "0a516fcb644f13e4d92d84d35682e55b51bb89b10c76dbf1c8b1c7a78f32d367",
          "source_anchor_state": "exact_span"
        },
        "source_model_id": "signaling",
        "source_order": 1153,
        "target_model_id": "confirmation-bias"
      },
      "disposition": "active_graph_slot",
      "path_coverage": {
        "exact_path_count": 2,
        "omitted_path_count": 0,
        "partial_reason": "",
        "serialized_path_count": 2,
        "status": "complete"
      },
      "provenance_paths": [
        {
          "authoring_pointer": {
            "family": "antagonists",
            "item_index": 0,
            "path": "data/curation/relation_semantics/signaling.json"
          },
          "compiled_pointer": "data/relationship_graph.json#/1153",
          "direction": "outgoing_authored_relation",
          "edge_type": "antagonist",
          "hop_count": 1,
          "relation_id": "signaling::confirmation-bias::antagonist",
          "source_custody": {
            "bytes": 17160,
            "exact_span": {
              "end_char_exclusive": 13444,
              "start_char": 13392
            },
            "path": "data/model_sources/Signaling_rag.md",
            "sha256": "0a516fcb644f13e4d92d84d35682e55b51bb89b10c76dbf1c8b1c7a78f32d367",
            "source_anchor_state": "exact_span"
          },
          "source_model_id": "signaling",
          "source_order": 1153,
          "target_model_id": "confirmation-bias"
        },
        {
          "authoring_pointer": {
            "family": "structured_tensions",
            "item_index": 1,
            "path": "data/curation/relation_semantics/signaling.json"
          },
          "compiled_pointer": "data/relationship_graph.json#/1155",
          "direction": "outgoing_authored_relation",
          "edge_type": "tension",
          "hop_count": 1,
          "relation_id": "signaling::confirmation-bias::tension",
          "source_custody": {
            "bytes": 17160,
            "exact_span": null,
            "path": "data/model_sources/Signaling_rag.md",
            "sha256": "0a516fcb644f13e4d92d84d35682e55b51bb89b10c76dbf1c8b1c7a78f32d367",
            "source_anchor_state": "unresolved"
          },
          "source_model_id": "signaling",
          "source_order": 1155,
          "target_model_id": "confirmation-bias"
        }
      ],
      "selected_relation_slot": "antagonist",
      "semantic_rejection_performed": false,
      "target_model_id": "confirmation-bias"
    },
    {
      "admission_path": null,
      "disposition": "reserve_graph_capacity",
      "path_coverage": {
        "exact_path_count": 2,
        "omitted_path_count": 0,
        "partial_reason": "",
        "serialized_path_count": 2,
        "status": "complete"
      },
      "provenance_paths": [
        {
          "authoring_pointer": {
            "family": "antagonists",
            "item_index": 0,
            "path": "data/curation/relation_semantics/social-proof.json"
          },
          "compiled_pointer": "data/relationship_graph.json#/1170",
          "direction": "outgoing_authored_relation",
          "edge_type": "antagonist",
          "hop_count": 1,
          "relation_id": "social-proof::critical-thinking::antagonist",
          "source_custody": {
            "bytes": 13155,
            "exact_span": null,
            "path": "data/model_sources/Social_Proof_rag.md",
            "sha256": "6e5dee9d9188be21aed265cf4b81482b181ee23623e3e2030830226b12478f8e",
            "source_anchor_state": "unresolved"
          },
          "source_model_id": "social-proof",
          "source_order": 1170,
          "target_model_id": "critical-thinking"
        },
        {
          "authoring_pointer": {
            "family": "structured_tensions",
            "item_index": 0,
            "path": "data/curation/relation_semantics/social-proof.json"
          },